{"schema":"contraste.index/v1","engine_version":"0.14.000","n_cases":22,"default_case":"C01","cases":[{"case_id":"C01","title":{"en":"Retail cards PD: champion vs challenger","es":"PD de tarjetas: campeón vs retador"},"category":{"en":"Credit scoring","es":"Scoring de crédito"},"category_id":"credit-scoring","kind":"real","manifest_path":"manifests/C01.json"},{"case_id":"C02","title":{"en":"Corporate PD across 1 to 5 year horizons","es":"PD corporativa a horizontes de 1 a 5 años"},"category":{"en":"Credit scoring","es":"Scoring de crédito"},"category_id":"credit-scoring","kind":"real","manifest_path":"manifests/C02.json"},{"case_id":"C03","title":{"en":"SME PD by vintage through 2008","es":"PD de pymes por cosecha a través de 2008"},"category":{"en":"Credit scoring","es":"Scoring de crédito"},"category_id":"credit-scoring","kind":"real","manifest_path":"manifests/C03.json"},{"case_id":"C04","title":{"en":"Rating transitions and TTC PD by grade","es":"Transiciones de calificación y PD TTC por grado"},"category":{"en":"Ratings and calibration","es":"Calificaciones y calibración"},"category_id":"ratings-calibration","kind":"real","manifest_path":"manifests/C04.json"},{"case_id":"C05","title":{"en":"Low-default portfolios and PD calibration","es":"Carteras de bajo incumplimiento y calibración de PD"},"category":{"en":"Ratings and calibration","es":"Calificaciones y calibración"},"category_id":"ratings-calibration","kind":"real","manifest_path":"manifests/C05.json"},{"case_id":"C06","title":{"en":"Lifetime PD, IFRS 9 staging and ECL on public small-business loans","es":"PD de por vida, etapas de IFRS 9 y pérdida esperada en préstamos públicos a pequeñas empresas"},"category":{"en":"Provisions","es":"Provisiones"},"category_id":"provisions","kind":"real","manifest_path":"manifests/C06.json"},{"case_id":"C07","title":{"en":"Chile provisions trilogy: CMF B-1 vs IFRS 9 vs BdE Annex 9","es":"Trilogía de provisiones en Chile: CMF B-1 vs IFRS 9 vs Anexo 9 del BdE"},"category":{"en":"Provisions","es":"Provisiones"},"category_id":"provisions","kind":"synthetic","manifest_path":"manifests/C07.json"},{"case_id":"C08","title":{"en":"LGD and downturn LGD","es":"LGD y LGD de recesión"},"category":{"en":"LGD and EAD","es":"LGD y EAD"},"category_id":"lgd-ead","kind":"real","manifest_path":"manifests/C08.json"},{"case_id":"C09","title":{"en":"EAD and CCF for revolving lines","es":"EAD y CCF de líneas rotativas"},"category":{"en":"LGD and EAD","es":"LGD y EAD"},"category_id":"lgd-ead","kind":"synthetic","manifest_path":"manifests/C09.json"},{"case_id":"C10","title":{"en":"Portfolio credit capital: ASRF, Vasicek fit, copula MC","es":"Capital de crédito de cartera: ASRF, ajuste de Vasicek, Monte Carlo con cópula"},"category":{"en":"Portfolio capital","es":"Capital de cartera"},"category_id":"portfolio-capital","kind":"real","manifest_path":"manifests/C10.json"},{"case_id":"C11","title":{"en":"Market VaR/ES backtesting across 2008, 2020, 2022, 2023","es":"Backtesting de VaR/ES de mercado en 2008, 2020, 2022 y 2023"},"category":{"en":"Market and counterparty risk","es":"Riesgo de mercado y de contraparte"},"category_id":"market-ccr","kind":"real","manifest_path":"manifests/C11.json"},{"case_id":"C12","title":{"en":"How large is the counterparty exposure of a swap book, and what CVA does it imply?","es":"¿Qué tan grande es la exposición a la contraparte de un libro de swaps y qué CVA implica?"},"category":{"en":"Market and counterparty risk","es":"Riesgo de mercado y de contraparte"},"category_id":"market-ccr","kind":"synthetic","manifest_path":"manifests/C12.json"},{"case_id":"C13","title":{"en":"FRTB desk eligibility: PLA and desk backtesting","es":"Elegibilidad de mesas FRTB: PLA y backtesting de mesa"},"category":{"en":"Market and counterparty risk","es":"Riesgo de mercado y de contraparte"},"category_id":"market-ccr","kind":"synthetic","manifest_path":"manifests/C13.json"},{"case_id":"C14","title":{"en":"IRRBB, six shocks on a USD balance sheet: the bank that failed in 2023","es":"IRRBB, seis choques sobre un balance en USD: el banco que quebró en 2023"},"category":{"en":"Balance sheet: IRRBB and liquidity","es":"Balance: IRRBB y liquidez"},"category_id":"balance-sheet","kind":"real","manifest_path":"manifests/C14.json"},{"case_id":"C15","title":{"en":"IRRBB on a CLP and UF balance sheet: RAN 21-13 Annex 1","es":"IRRBB sobre un balance en CLP y UF: Anexo 1 de la RAN 21-13"},"category":{"en":"Balance sheet: IRRBB and liquidity","es":"Balance: IRRBB y liquidez"},"category_id":"balance-sheet","kind":"synthetic","manifest_path":"manifests/C15.json"},{"case_id":"C16","title":{"en":"Liquidity stress, LCR and the March 2023 run","es":"Estrés de liquidez, LCR y la corrida de marzo de 2023"},"category":{"en":"Balance sheet: IRRBB and liquidity","es":"Balance: IRRBB y liquidez"},"category_id":"balance-sheet","kind":"real","manifest_path":"manifests/C16.json"},{"case_id":"C17","title":{"en":"Operational risk: LDA vs SMA","es":"Riesgo operacional: LDA vs SMA"},"category":{"en":"Operational risk","es":"Riesgo operacional"},"category_id":"operational","kind":"synthetic","manifest_path":"manifests/C17.json"},{"case_id":"C18","title":{"en":"ICAAP and IAPE capital aggregation under macro scenarios","es":"Agregación de capital ICAAP e IAPE bajo escenarios macro"},"category":{"en":"Capital and stress testing","es":"Capital y pruebas de tensión"},"category_id":"capital-stress","kind":"real","manifest_path":"manifests/C18.json"},{"case_id":"C19","title":{"en":"Supervisory stress model replication (known answer)","es":"Réplica de modelos de estrés supervisor (respuesta conocida)"},"category":{"en":"Capital and stress testing","es":"Capital y pruebas de tensión"},"category_id":"capital-stress","kind":"real","manifest_path":"manifests/C19.json"},{"case_id":"C20","title":{"en":"ML model validation: drift, robustness, explanation stability","es":"Validación de modelos de ML: deriva, robustez y estabilidad de explicaciones"},"category":{"en":"ML and AI model risk","es":"Riesgo de modelos de ML e IA"},"category_id":"ml-ai-risk","kind":"real","manifest_path":"manifests/C20.json"},{"case_id":"C21","title":{"en":"Fair-lending disparity testing","es":"Pruebas de disparidad en crédito justo"},"category":{"en":"ML and AI model risk","es":"Riesgo de modelos de ML e IA"},"category_id":"ml-ai-risk","kind":"real","manifest_path":"manifests/C21.json"},{"case_id":"C22","title":{"en":"Validating the validator: size and power of every test","es":"Validar al validador: tamaño y potencia de cada prueba"},"category":{"en":"Validating the validator","es":"Validar al validador"},"category_id":"validator","kind":"synthetic","manifest_path":"manifests/C22.json"}],"files":["contract/scored_sample.json","contract/loan_panel.json","contract/rating_history.json","contract/market_series.json","contract/curve.json","contract/balance_sheet.json","contract/loss_events.json","contract/macro_path.json","contract/index.json","regulatory/calculators.json"]}